{
  "schema_version": 1,
  "number": "022",
  "id": "pa-registered-county-policy",
  "discovery": {
    "operation_id": "checkPennsylvaniaRegisteredCountyPolicy",
    "service_name": "PA Registered County Policy",
    "summary": "Check a Pennsylvania registered county against caller policy",
    "description": "Resolve a Pennsylvania business name to one strong registry entity and compare its source-published registered county with caller-supplied allowedCounties. Returns policy_match, policy_mismatch, company_not_found, or human_review. The result evaluates only the supplied registered-county policy and does not prove physical operations, headquarters, service area, residency, local ownership, tax situs, good standing, authority, or legal compliance.",
    "resource_description": "Resolve a Pennsylvania business to one strong registry entity and compare its source-published registered county with a caller-supplied Pennsylvania county allowlist. Returns policy_match, policy_mismatch, company_not_found, or human_review. This is a caller-defined workflow policy check only; it does not prove physical operations, headquarters location, service area, residency, local ownership, tax situs, good standing, authority, or legal compliance.",
    "search_tags": [
      "pennsylvania-business-registry",
      "registered-county",
      "local-vendor-policy",
      "procurement-policy",
      "human-review"
    ],
    "openapi_tags": [
      "Pennsylvania Business Registry",
      "Registered County",
      "Local Vendor Policy"
    ]
  },
  "buyer": {
    "task": "Resolve a Pennsylvania business to one strong registry entity and compare its source-published registered county with a caller-supplied allowed Pennsylvania county set.",
    "expected_purchase_frequency": {
      "status": "unmeasured",
      "value": null,
      "unit": null,
      "measurement_plan": "Measure independently verified external settled purchases and repeat demand; do not treat synthetic fixtures, public discovery or HTTP 200 as sales."
    }
  },
  "api": {
    "method": "GET",
    "path": "/api/pa-registered-county-policy",
    "inputs": [
      {
        "name": "company",
        "type": "string",
        "minLength": 2,
        "maxLength": 120,
        "required": true
      },
      {
        "name": "allowedCounties",
        "type": "string",
        "required": true
      }
    ],
    "example_query": {
      "company": "OpenAI OpCo",
      "allowedCounties": "Dauphin,Schuylkill"
    },
    "payment_example_output": {
      "decision": "policy_match",
      "registeredCounty": "Dauphin",
      "paid": true
    },
    "outputs": {
      "decisions": [
        "policy_match",
        "policy_mismatch",
        "company_not_found",
        "human_review"
      ],
      "fields": [
        "decision",
        "reasonCodes",
        "reasonCode",
        "allowedCounties",
        "registeredCounty",
        "sourceCounty",
        "matchedEntity",
        "checkedAt",
        "input",
        "sourceFailures",
        "evidence",
        "chargeable",
        "paid",
        "price"
      ]
    },
    "input_rule": null
  },
  "sources": [
    {
      "id": "pa_registry",
      "adapter": "createPaRegistryAdapter",
      "authority": "Pennsylvania Department of State via data.pa.gov",
      "refresh_policy": "live lookup on each paid request",
      "cache_policy": "none",
      "freshness_limit_seconds": null
    }
  ],
  "decision": {
    "implementation": "products/pa-registered-county-policy/decision.js",
    "parameters": {
      "allowedCounties": "caller-supplied, validated against 67 Pennsylvania counties",
      "maxCount": 67,
      "acceptOptionalCountySuffix": true
    },
    "rules": [
      "Resolve one strong PA registry business and read its source-published registered county.",
      "Normalize county names including optional County suffix and compare with the caller-declared allowedCounties set.",
      "No match is only a caller policy outcome, not evidence of physical operations, residency, jurisdiction or legal compliance.",
      "policy_match evaluates only source-published registered county against caller policy",
      "it does not prove physical operations, headquarters, service area, residency, local ownership, tax situs, good standing, authority, or legal compliance"
    ]
  },
  "failure_behavior": {
    "invalid_input": "HTTP 400; do not settle payment.",
    "required_source_failure": "HTTP 502 with chargeable=false; do not settle payment.",
    "payment_unresolved": "HTTP 503; retry the same authorization.",
    "automatic_reject": false
  },
  "economics": {
    "price_usdc": "0.002",
    "paid_settlement_cost_usd": "0.002310",
    "configured_direct_source_fee_usd": "0.000000",
    "incremental_hosting_cost_usd": null,
    "post_allowance_margin_floor_pct": -15.5,
    "target_contribution_margin_pct": 70,
    "meets_target_before_unknown_costs": false
  },
  "launch": {
    "current_status": "live-source-verified-staging",
    "release_gate": "scripts/validate-product-022.js",
    "criteria": [
      "Existing exact-revision release gate and deterministic tests must pass before a reviewed deployment.",
      "Independently verify authoritative-source availability, payment identity, and current facilitator fee/allowance terms.",
      "Commercial release remains blocked until true hosting/source/refund economics and independently verified customer demand are established."
    ]
  },
  "implementation": {
    "handler_template": "standard-x402-get-v1",
    "service_module": "products/pa-registered-county-policy/service.js",
    "input_validator_export": "validateRegisteredCountyPolicyInput"
  }
}
