{
  "schema_version": 1,
  "number": "016",
  "id": "pa-entity-ofac-review",
  "discovery": {
    "operation_id": "reviewPennsylvaniaEntityOfacName",
    "service_name": "PA Entity OFAC Review Gate",
    "summary": "Resolve a PA legal entity and screen its legal name against OFAC",
    "description": "Resolve a supplied Pennsylvania company name to one unique strong Department of State legal-entity match, then screen the resolved legal name against current OFAC SDN primary-name and alias data. Returns candidate_found, no_candidate, company_not_found, or human_review. This is first-pass candidate-name screening only: a candidate is not a legal sanctions determination, no_candidate is not sanctions clearance, and OFAC 50 Percent Rule ownership analysis is not included.",
    "resource_description": "Resolve a Pennsylvania company to a unique legal entity and screen the resolved legal name against the current U.S. Treasury OFAC SDN primary-name and alias data. Returns candidate_found, no_candidate, company_not_found, or human_review. Candidate-name screening is not a legal sanctions determination; no_candidate is not sanctions clearance and OFAC 50 Percent Rule ownership analysis is not included.",
    "search_tags": [
      "pennsylvania-business-registry",
      "OFAC",
      "SDN",
      "legal-entity",
      "sanctions-screening"
    ],
    "openapi_tags": [
      "Pennsylvania Business Registry",
      "OFAC",
      "SDN",
      "Vendor Identity",
      "Human Review"
    ]
  },
  "buyer": {
    "task": "Resolve a prospective Pennsylvania company to a unique legal entity, then run deterministic current OFAC SDN primary-name and alias screening against the resolved legal name.",
    "expected_purchase_frequency": {
      "status": "unmeasured",
      "value": null,
      "unit": null,
      "measurement_plan": "Measure only independent external settled buyers and repeat demand; never count test responses, discovery visits, or synthetic transactions as sales."
    }
  },
  "api": {
    "method": "GET",
    "path": "/api/pa-entity-ofac-review",
    "inputs": [
      {
        "name": "company",
        "type": "string",
        "minLength": 2,
        "maxLength": 120,
        "required": true
      },
      {
        "name": "minScore",
        "type": "integer",
        "minimum": 70,
        "maximum": 100,
        "default": 90,
        "required": false
      }
    ],
    "example_query": {
      "company": "OpenAI OpCo",
      "minScore": 90
    },
    "payment_example_query": {
      "company": "OpenAI OpCo",
      "minScore": "90"
    },
    "payment_example_output": {
      "decision": "no_candidate",
      "screenedName": "Openai Opco, Llc",
      "candidateCount": 0,
      "paid": true
    },
    "outputs": {
      "decisions": [
        "candidate_found",
        "no_candidate",
        "company_not_found",
        "human_review"
      ],
      "fields": [
        "decision",
        "reasonCodes",
        "checks",
        "matchedEntity",
        "screenedName",
        "candidateCount",
        "candidates",
        "minScore",
        "limitations",
        "checkedAt",
        "input",
        "sourceFailures",
        "evidence",
        "chargeable",
        "paid",
        "price"
      ]
    },
    "input_rule": null
  },
  "sources": [
    {
      "id": "pa_registry",
      "adapter": "createPaRegistryAdapter",
      "authority": "Pennsylvania Department of State via data.pa.gov",
      "refresh_policy": "Live unique strong legal-entity resolution on paid request",
      "cache_policy": "none",
      "freshness_limit_seconds": null
    },
    {
      "id": "ofac_sdn",
      "adapter": "createOfacNameAdapter",
      "authority": "U.S. Treasury OFAC SDN names and aliases",
      "refresh_policy": "Current SDN name/alias screening only after unique legal-entity resolution",
      "cache_policy": "adapter controlled",
      "freshness_limit_seconds": null
    }
  ],
  "decision": {
    "implementation": "products/pa-entity-ofac-review/decision.js",
    "parameters": {
      "minScore": {
        "default": 90,
        "minimum": 70,
        "maximum": 100
      },
      "ofacCandidateLimit": 3
    },
    "rules": [
      "Resolve a unique strong Pennsylvania legal entity before screening the legal name, not the raw submitted name.",
      "Use deterministic current OFAC name/alias candidates at caller-selected minScore.",
      "A candidate is for review; no_candidate is not sanctions clearance or 50 Percent Rule ownership analysis.",
      "candidate-name screening only; a candidate is not a legal sanctions determination",
      "no_candidate is not sanctions clearance",
      "OFAC 50 Percent Rule ownership analysis is not included",
      "a Pennsylvania registry match does not prove good standing, ownership, or authority to contract"
    ]
  },
  "failure_behavior": {
    "invalid_input": "HTTP 400; payment is not settled.",
    "required_source_failure": "HTTP 502 with chargeable=false; payment is not settled.",
    "payment_unresolved": "HTTP 503; retry the same authorization.",
    "automatic_reject": false
  },
  "economics": {
    "price_usdc": "0.005",
    "paid_settlement_cost_usd": "0.002310",
    "configured_direct_source_fee_usd": "0.000000",
    "incremental_hosting_cost_usd": null,
    "post_allowance_margin_floor_pct": 53.8,
    "target_contribution_margin_pct": 70,
    "meets_target_before_unknown_costs": false
  },
  "launch": {
    "current_status": "live-source-verified-staging",
    "release_gate": "scripts/validate-product-016.js",
    "criteria": [
      "Exact-head existing product release gates and deterministic/source checks must pass.",
      "Authority-dependent live smokes and required production credentials (including SEC_USER_AGENT) must pass before any approved deployment.",
      "Complete unit economics and genuine independent external-buyer evidence are unavailable; do not authorize commercial release."
    ]
  },
  "implementation": {
    "handler_template": "standard-x402-get-v1",
    "service_module": "products/pa-entity-ofac-review/service.js",
    "input_validator_export": "validatePaEntityOfacInput"
  }
}
