{
  "schema_version": 1,
  "number": "015",
  "id": "treasury-average-rate-spread",
  "discovery": {
    "operation_id": "compareTreasuryAverageRateSpread",
    "service_name": "Treasury Average Rate Spread",
    "summary": "Compare two Treasury average-rate categories",
    "description": "Compare the latest official monthly weighted-average interest rates for two Treasury security categories using the same Fiscal Data record date. Returns left_higher, right_higher, within_tolerance, or human_review. spreadBps is left minus right in basis points. This is not a live market yield spread, yield-curve trading signal, forecast, or investment recommendation.",
    "resource_description": "Compare the latest official monthly weighted-average interest rates for two U.S. Treasury security categories from the same Fiscal Data record date. Returns left_higher, right_higher, within_tolerance, or human_review. This is not a live market yield spread, forecast, or investment recommendation.",
    "search_tags": [
      "treasury",
      "interest-rates",
      "rate-spread",
      "macro",
      "government-data"
    ],
    "openapi_tags": [
      "Treasury",
      "Interest Rates",
      "Rate Spread",
      "Macro"
    ]
  },
  "buyer": {
    "task": "Compare the latest official monthly weighted-average interest rates for two U.S. Treasury security categories from the same record date and classify their spread.",
    "expected_purchase_frequency": {
      "status": "unmeasured",
      "value": null,
      "unit": null,
      "measurement_plan": "Measure only independent external settled buyers and repeat demand; never count test responses, discovery visits, or synthetic transactions as sales."
    }
  },
  "api": {
    "method": "GET",
    "path": "/api/treasury-average-rate-spread",
    "inputs": [
      {
        "name": "leftSecurity",
        "type": "string",
        "minLength": 2,
        "maxLength": 100,
        "required": true
      },
      {
        "name": "rightSecurity",
        "type": "string",
        "minLength": 2,
        "maxLength": 100,
        "required": true
      },
      {
        "name": "toleranceBps",
        "type": "number",
        "minimum": 0,
        "maximum": 1000,
        "default": 2,
        "required": false
      }
    ],
    "example_query": {
      "leftSecurity": "Treasury Bills",
      "rightSecurity": "Treasury Notes",
      "toleranceBps": 2
    },
    "payment_example_query": {
      "leftSecurity": "Treasury Bills",
      "rightSecurity": "Treasury Notes",
      "toleranceBps": "2"
    },
    "payment_example_output": {
      "decision": "left_higher",
      "spreadBps": 66.7,
      "toleranceBps": 2,
      "paid": true
    },
    "outputs": {
      "decisions": [
        "left_higher",
        "right_higher",
        "within_tolerance",
        "human_review"
      ],
      "fields": [
        "decision",
        "reasonCodes",
        "checks",
        "recordDate",
        "left",
        "right",
        "spreadBps",
        "toleranceBps",
        "policy",
        "checkedAt",
        "input",
        "sourceFailures",
        "evidence",
        "chargeable",
        "paid",
        "price"
      ]
    },
    "input_rule": null
  },
  "sources": [
    {
      "id": "treasury_fiscal_data",
      "adapter": "createTreasuryAverageRatesAdapter",
      "authority": "U.S. Treasury Fiscal Data monthly Average Interest Rates on U.S. Treasury Securities",
      "refresh_policy": "Compare latest records for two distinct security categories on the same official record date",
      "cache_policy": "adapter controlled",
      "freshness_limit_seconds": null
    }
  ],
  "decision": {
    "implementation": "products/treasury-average-rate-spread/decision.js",
    "parameters": {
      "toleranceBps": {
        "default": 2,
        "minimum": 0,
        "maximum": 1000
      }
    },
    "rules": [
      "Require distinct security descriptions and two valid Treasury rate observations for the same record date.",
      "Compute left-minus-right spread in basis points and apply inclusive tolerance.",
      "A monthly average spread is not a live yield spread or trading signal.",
      "the source values are monthly weighted-average rates on outstanding Treasury securities",
      "the spread is not a live market yield spread",
      "the result is not a forecast, curve-trading signal, or investment recommendation"
    ]
  },
  "failure_behavior": {
    "invalid_input": "HTTP 400; payment is not settled.",
    "required_source_failure": "HTTP 502 with chargeable=false; payment is not settled.",
    "payment_unresolved": "HTTP 503; retry the same authorization.",
    "automatic_reject": false
  },
  "economics": {
    "price_usdc": "0.003",
    "paid_settlement_cost_usd": "0.002310",
    "configured_direct_source_fee_usd": "0.000000",
    "incremental_hosting_cost_usd": null,
    "post_allowance_margin_floor_pct": 23,
    "target_contribution_margin_pct": 70,
    "meets_target_before_unknown_costs": false
  },
  "launch": {
    "current_status": "live-source-verified-staging",
    "release_gate": "scripts/validate-product-015.js",
    "criteria": [
      "Exact-head existing product release gates and deterministic/source checks must pass.",
      "Authority-dependent live smokes and required production credentials (including SEC_USER_AGENT) must pass before any approved deployment.",
      "Complete unit economics and genuine independent external-buyer evidence are unavailable; do not authorize commercial release."
    ]
  },
  "implementation": {
    "handler_template": "standard-x402-get-v1",
    "service_module": "products/treasury-average-rate-spread/service.js",
    "input_validator_export": "validateTreasuryRateSpreadInput"
  }
}
